{
  "schema_version": "geometry_manifest.v1",
  "module_name": "garment",
  "contract_version": "v0.9-revD",
  "created_at": "2026-02-08T12:00:01Z",
  "inputs_fingerprint": "b2c3d4e5f6a10003b2c3d4e5f6a10003b2c3d4e5f6a10003b2c3d4e5f6a10003",
  "version_keys": {
    "snapshot_version": "s1",
    "semantic_version": "v0.9",
    "geometry_impl_version": "proxy_v0",
    "dataset_version": "garment_ds_v1"
  },
  "artifacts": [
    "garment_proxy_meta.json",
    "garment_proxy_mesh.glb"
  ],
  "warnings": []
}
