{
  "schema_version": "geometry_manifest.v1",
  "module_name": "fitting",
  "contract_version": "v1.0-revH",
  "created_at": "2026-02-08T12:00:02Z",
  "inputs_fingerprint": "c3d4e5f6a1b20001c3d4e5f6a1b20001c3d4e5f6a1b20001c3d4e5f6a1b20001",
  "version_keys": {
    "snapshot_version": "s1",
    "semantic_version": "v1.0",
    "geometry_impl_version": "fit_v0",
    "dataset_version": "sizekorea_v2"
  },
  "artifacts": [
    "fitting_facts_summary.json"
  ],
  "warnings": []
}
