{
  "schema_version": "geometry_manifest.v1",
  "module_name": "body",
  "contract_version": "v1.1",
  "created_at": "2026-02-08T12:00:00Z",
  "inputs_fingerprint": "a1b2c3d4e5f60003a1b2c3d4e5f60003a1b2c3d4e5f60003a1b2c3d4e5f60003",
  "version_keys": {
    "snapshot_version": "s1",
    "semantic_version": "v1.0",
    "geometry_impl_version": "geo_v0",
    "dataset_version": "sizekorea_v2"
  },
  "artifacts": [
    "body_mesh.npz",
    "body_measurements_subset.json"
  ],
  "warnings": ["MISSINGNESS_HIGH_WARNING_DEGRADED"]
}
